bodyPart,equipment,gifUrl,id,name,target,secondaryMuscles__001,secondaryMuscles__002,secondaryMuscles__003,instructions__001,instructions__002,instructions__003,instructions__004,instructions__005,instructions__006,instructions__007,,,,,,,,,,,
upper legs,band,https://i.ibb.co/pnkFMYh/13.gif,987,band one arm single leg split squat,quads,glutes,hamstrings,,,Stand with your feet hip-width apart and place a resistance band around your ankles.,Extend one leg forward and rest the top of your foot on a bench or step behind you.,Hold onto a support with one hand for balance.,Bend your standing leg and lower your body down into a squat position, keeping your knee in line with your toes.,Push through your heel to return to the starting position.,Repeat for the desired number of repetitions, then switch legs.,,,,,,,,,
upper legs,band,https://i.ibb.co/zs5yStR/14.gif,1001,band single leg split squat,quads,glutes,hamstrings,,,Stand with your feet hip-width apart and place a resistance band around your ankles.,Take a big step forward with your right foot and a smaller step back with your left foot.,Bend your knees and lower your body until your right thigh is parallel to the ground, keeping your left knee slightly above the ground.,Push through your right heel to return to the starting position.,Repeat on the other side.,,,,,,,,,,,
upper legs,band,https://i.ibb.co/jkqf0SC/15.gif,1004,band squat,glutes,quadriceps,hamstrings,calves,,Stand with your feet shoulder-width apart, with the band placed just above your knees.,Keeping your chest up and core engaged, push your hips back and bend your knees to lower into a squat position.,Make sure your knees are tracking over your toes and your weight is in your heels.,Pause for a moment at the bottom, then push through your heels to return to the starting position.,Repeat for the desired number of repetitions.,,,,,,,,,
upper legs,band,https://i.ibb.co/wMF0npm/16.gif,1003,band squat row,glutes,hamstrings,quadriceps,back,,Attach the band to a sturdy anchor point at waist height.,Stand facing the anchor point with your feet shoulder-width apart.,Hold the band handles with your palms facing each other and your arms extended in front of you.,Bend your knees and lower into a squat position, keeping your back straight and chest lifted.,From the squat position, pull the band handles towards your body, squeezing your shoulder blades together.,Pause for a moment at the top, then slowly release the tension and return to the starting position.,Repeat for the desired number of repetitions.,,,,,,
upper legs,band,https://i.ibb.co/wJQHcY5/17gif.gif,1008,band step-up,glutes,quadriceps,hamstrings,calves,,Place a band around your thighs, just above your knees.,Stand facing a step or platform with your feet hip-width apart.,Step up onto the platform with your right foot, pushing through your heel.,Extend your left leg behind you, keeping it straight.,Lower your left foot back down to the ground.,Repeat with your left foot stepping up onto the platform.,Continue alternating legs for the desired number of repetitions.,,,,,,,
upper legs,band,https://i.ibb.co/vkX4dJc/18.gif,1009,band stiff leg deadlift,glutes,hamstrings,lower back,,,Stand with your feet shoulder-width apart and place the band around your ankles.,Hold the band with both hands in front of your thighs, palms facing your body.,Keeping your back straight and your core engaged, hinge at the hips and slowly lower your upper body towards the ground.,As you lower, push your hips back and allow your knees to bend slightly.,Lower the band towards the ground, feeling a stretch in your hamstrings.,Pause for a moment at the bottom, then engage your glutes and hamstrings to lift your upper body back up to the starting position.,Repeat for the desired number of repetitions.,,,,,
upper legs,band,https://i.ibb.co/jgBdRD5/19.gif,1023,band straight back stiff leg deadlift,glutes,hamstrings,lower back,,,Stand with your feet shoulder-width apart and place the band around your upper legs.,Hold the band with both hands in front of your thighs, palms facing your body.,Keeping your back straight and your knees slightly bent, hinge at the hips and lower the band towards the ground.,Feel the stretch in your hamstrings as you lower the band.,Engage your glutes and hamstrings to lift your body back up to the starting position.,Repeat for the desired number of repetitions.,,,,,,,,,
