bodyPart,equipment,gifUrl,id,name,target,secondaryMuscles__001,secondaryMuscles__002,secondaryMuscles__003,instructions__001,instructions__002,instructions__003,instructions__004,instructions__005,instructions__006,instructions__007,,,,,,,,,,,
shoulders,band,https://i.ibb.co/8xmSS99/7.gif,1017,band y-raise,delts,traps,rhomboids,,Stand with your feet shoulder-width apart and hold the band in front of your thighs with your palms facing inwards.,Keep your arms straight and lift them up and out to the sides, forming a 'Y' shape with your body.,Squeeze your shoulder blades together at the top of the movement.,Slowly lower your arms back down to the starting position.,Repeat for the desired number of repetitions.,,,,,,,,,,,,
shoulders,barbell,https://i.ibb.co/PFYTnjr/8.gif,41,barbell front raise,delts,biceps,triceps,,Stand with your feet shoulder-width apart and hold a barbell in front of your thighs with an overhand grip.,Keep your arms straight and lift the barbell forward and upward until it reaches shoulder level.,Pause for a moment at the top, then slowly lower the barbell back down to the starting position.,Repeat for the desired number of repetitions.,,,,,,,,,,,,,
shoulders,barbell,https://i.ibb.co/JdcNkvs/9.gif,67,barbell one arm snatch,delts,traps,forearms,core,Stand with your feet shoulder-width apart, toes pointing slightly outwards.,Hold the barbell with an overhand grip, hands slightly wider than shoulder-width apart.,Bend your knees and lower your hips into a squat position, keeping your back straight and chest up.,Explosively extend your hips, knees, and ankles, driving the barbell upwards.,As the barbell reaches chest level, pull it upwards with your arm, keeping it close to your body.,Rotate your elbow under the barbell and extend your arm fully overhead, locking out your elbow.,Lower the barbell back down to the starting position in a controlled manner.,Repeat for the desired number of repetitions, then switch arms.
shoulders,barbell,https://i.ibb.co/F6SJsgF/10.gif,75,barbell rear delt raise,delts,traps,rhomboids,,Stand with your feet shoulder-width apart and hold a barbell with an overhand grip, palms facing down.,Bend your knees slightly and hinge forward at the hips, keeping your back straight.,Raise the barbell out to the sides, keeping your arms straight, until they are parallel to the ground.,Pause for a moment at the top, then slowly lower the barbell back to the starting position.,Repeat for the desired number of repetitions.,,,,,,,,
cardio,body weight,https://i.ibb.co/bHBHDdq/1.gif,3220,astride jumps (male),cardiovascular system,quadriceps,hamstrings,calves,,,,Stand with your feet shoulder-width apart.,Bend your knees and lower your body into a squat position.,Jump explosively upwards, extending your legs and arms.,While in the air, spread your legs apart and bring your arms out to the sides.,Land softly with your feet shoulder-width apart, bending your knees to absorb the impact.,Repeat for the desired number of repetitions.,,,,,,
cardio,body weight,https://i.ibb.co/D4h7Cfn/2.gif,3672,back and forth step,cardiovascular system,quadriceps,hamstrings,glutes,calves,,,Stand with your feet shoulder-width apart.,Step forward with your right foot, bending your knee and lowering your body into a lunge position.,Push off with your right foot and step back to the starting position.,Repeat the movement with your left foot, alternating legs with each step.,Continue stepping back and forth, maintaining a steady pace.,Repeat for the desired duration or number of repetitions.,,,,,,
cardio,body weight,https://i.ibb.co/SBNnSn6/3I.gif,3360,bear crawl,cardiovascular system,core,shoulders,triceps,,,,Start on all fours with your hands directly under your shoulders and your knees directly under your hips.,Lift your knees slightly off the ground, keeping your back flat and your core engaged.,Move your right hand and left foot forward simultaneously, followed by your left hand and right foot.,Continue crawling forward, alternating your hand and foot movements.,Maintain a steady pace and keep your core tight throughout the exercise.,Continue for the desired distance or time.,,,,,,
cardio,body weight,https://i.ibb.co/3cybWZH/4.gif,1160,burpee,cardiovascular system,quadriceps,hamstrings,calves,shoulders,chest,,Start in a standing position with your feet shoulder-width apart.,Lower your body into a squat position by bending your knees and placing your hands on the floor in front of you.,Kick your feet back into a push-up position.,Perform a push-up, keeping your body in a straight line.,Jump your feet back into the squat position.,Jump up explosively, reaching your arms overhead.,Land softly and immediately lower back into a squat position to begin the next repetition.,,,,,,
cardio,leverage machine,https://i.ibb.co/tBc98qj/5.gif,2331,cycle cross trainer,cardiovascular system,quadriceps,hamstrings,glutes,,,,Adjust the seat height and position yourself on the cycle cross trainer.,Place your feet on the pedals and grip the handlebars.,Start pedaling in a smooth and controlled motion.,Maintain a steady pace and increase the resistance if desired.,Continue pedaling for the desired duration of your cardio workout.,,,,,,,,,,
cardio,dumbbell,https://i.ibb.co/hg4B2nN/6.gif,1201,dumbbell burpee,cardiovascular system,quadriceps,hamstrings,calves,shoulders,triceps,core,Start in a standing position with your feet shoulder-width apart and a dumbbell in each hand.,Lower your body into a squat position, placing the dumbbells on the ground in front of you.,Kick your feet back into a push-up position, keeping your body in a straight line.,Perform a push-up, bending your elbows and lowering your chest towards the ground.,Jump your feet back towards your hands, landing in a squat position.,Stand up explosively, lifting the dumbbells off the ground and bringing them to your shoulders.,Press the dumbbells overhead, fully extending your arms.,Lower the dumbbells back to your shoulders and repeat the entire sequence for the desired number of repetitions.,
cardio,body weight,https://i.ibb.co/y5JVY7n/7.gif,3221,half knee bends (male),cardiovascular system,quadriceps,hamstrings,glutes,,,,Stand with your feet shoulder-width apart.,Bend your knees and lower your body down as if you were sitting back into a chair.,Keep your chest up and your weight in your heels.,Pause for a moment at the bottom, then push through your heels to return to the starting position.,Repeat for the desired number of repetitions.,,,,,,,,,
cardio,body weight,https://i.ibb.co/G9Fv2hz/8.gif,3636,high knee against wall,cardiovascular system,quadriceps,hamstrings,glutes,calves,,,Stand facing a wall with your feet hip-width apart.,Place your hands on the wall for support.,Engage your core and lift your right knee up towards your chest, while keeping your left foot on the ground.,Quickly switch legs, bringing your left knee up towards your chest and lowering your right foot back down.,Continue alternating legs in a running motion, bringing your knees up as high as possible.,Maintain a fast pace and keep your upper body stable throughout the exercise.,Repeat for the desired duration or number of repetitions.,,,,,
cardio,body weight,https://i.ibb.co/tx75Rxq/9.gif,501,jack burpee,cardiovascular system,quadriceps,hamstrings,calves,shoulders,triceps,core,Start in a standing position with your feet shoulder-width apart.,Lower your body into a squat position, placing your hands on the ground in front of you.,Kick your feet back, landing in a push-up position.,Perform a push-up, lowering your chest to the ground and then pushing back up.,Jump your feet forward, landing in a squat position.,Jump up explosively, reaching your arms overhead.,Land softly and immediately lower back into the squat position to begin the next repetition.,,,
cardio,body weight,https://i.ibb.co/2sH8DFk/10.gif,3224,jack jump (male),cardiovascular system,quadriceps,calves,,,,,Stand with your feet together and your arms by your sides.,Jump up, spreading your feet apart and raising your arms above your head.,As you land, quickly jump back to the starting position.,Repeat for the desired number of repetitions.,,,,,,,,,
neck,body weight,https://i.ibb.co/HG7m531/1.gif,1403,neck side stretch,levator scapulae,trapezius,sternocleidomastoid,Stand or sit up straight with your shoulders relaxed.,Tilt your head to one side, bringing your ear towards your shoulder.,Hold the stretch for 15-30 seconds.,Repeat on the other side.,Perform 2-4 sets on each side.,,,,,,,,,,,,,
neck,body weight,https://i.ibb.co/T41zn5C/2.gif,716,side push neck stretch,levator scapulae,trapezius,sternocleidomastoid,Stand or sit up straight with your shoulders relaxed.,Tilt your head to the right, bringing your right ear towards your right shoulder.,Place your right hand on the left side of your head and gently apply pressure to increase the stretch.,Hold the stretch for 15-30 seconds.,Repeat on the other side, tilting your head to the left and applying pressure with your left hand.,Repeat the stretch 2-3 times on each side.,,,,,,,,,,,
lower legs,body weight,https://i.ibb.co/n3sSZRy/1.gif,1368,ankle circles,calves,ankle stabilizers,,Sit on the ground with your legs extended in front of you.,Lift one leg off the ground and rotate your ankle in a circular motion.,Perform the desired number of circles in one direction, then switch to the other direction.,Repeat with the other leg.,,,,,,,,,,,,,,
lower legs,assisted,https://i.ibb.co/tcLDz5N/2.gif,1708,assisted lying calves stretch,calves,hamstrings,,Lie on your back with your legs extended.,Bend one knee and place your foot flat on the ground.,Using your hands or a towel, gently pull your toes towards your body, feeling a stretch in your calf.,Hold the stretch for 20-30 seconds.,Release the stretch and repeat on the other leg.,,,,,,,,,,,,
lower legs,band,https://i.ibb.co/PWpFfZQ/3.gif,999,band single leg calf raise,calves,ankles,feet,Stand with your feet hip-width apart and place the band around the ball of your left foot.,Hold onto a stable object for balance if needed.,Slowly raise your left heel off the ground, lifting your body weight onto the ball of your foot.,Pause for a moment at the top, then slowly lower your left heel back down to the starting position.,Repeat for the desired number of repetitions, then switch to the right leg.,,,,,,,,,,,
lower legs,band,https://i.ibb.co/WKLRwHj/4.gif,1000,band single leg reverse calf raise,calves,hamstrings,glutes,Stand with your feet hip-width apart and place the band around the ball of your foot.,Hold onto a stable object for balance.,Slowly raise your heel off the ground, lifting your body weight onto the ball of your foot.,Pause for a moment at the top, then slowly lower your heel back down to the starting position.,Repeat for the desired number of repetitions, then switch to the other leg.,,,,,,,,,,,
lower legs,band,https://i.ibb.co/vJDZZVm/5.gif,1369,band two legs calf raise - (band under both legs) v. 2,calves,ankles,feet,Stand with your feet shoulder-width apart and place a resistance band under both feet.,Hold the ends of the band with your hands for stability.,Raise your heels off the ground as high as possible, using your calves.,Pause for a moment at the top, then slowly lower your heels back down to the starting position.,Repeat for the desired number of repetitions.,,,,,,,,,,,,
lower legs,barbell,https://i.ibb.co/mT8cbr6/6.gif,1370,barbell floor calf raise,calves,hamstrings,,Place a barbell on the floor in front of you.,Stand with the balls of your feet on the edge of the barbell, with your heels hanging off.,Hold onto a stable object for balance if needed.,Raise your heels as high as possible, using your calves to lift your body.,Pause for a moment at the top, then slowly lower your heels back down to the starting position.,Repeat for the desired number of repetitions.,,,,,,,,,,
lower legs,barbell,https://i.ibb.co/yYPcvp3/7.gif,88,barbell seated calf raise,calves,hamstrings,quadriceps,Sit on a bench with your feet flat on the floor and a barbell resting on your thighs.,Place the balls of your feet on a raised platform, such as a block or step.,Position the barbell across your thighs and hold it securely with your hands.,Keeping your back straight and your core engaged, lift your heels off the ground by extending your ankles.,Pause for a moment at the top, then slowly lower your heels back down to the starting position.,Repeat for the desired number of repetitions.,,,,,,,,,,
lower legs,barbell,https://i.ibb.co/yhtYKXf/8.gif,1371,barbell seated calf raise,calves,hamstrings,,Sit on a bench with your feet flat on the floor and a barbell resting on your thighs.,Place the balls of your feet on a raised platform, such as a block or step.,Lower your heels as far as possible, feeling a stretch in your calves.,Raise your heels as high as possible, contracting your calves.,Repeat for the desired number of repetitions.,,,,,,,,,,,
lower legs,barbell,https://i.ibb.co/TYfkc73/9.gif,1372,barbell standing calf raise,calves,hamstrings,glutes,Stand with your feet shoulder-width apart and place a barbell across your upper back.,Raise your heels off the ground as high as possible, using only your toes.,Pause for a moment at the top, then slowly lower your heels back down to the starting position.,Repeat for the desired number of repetitions.,,,,,,,,,,,,,
lower legs,barbell,https://i.ibb.co/4VWRqv3/10.gif,108,barbell standing leg calf raise,calves,hamstrings,glutes,Stand with your feet shoulder-width apart and place a barbell across your upper back.,Raise your heels off the ground as high as possible, using your calves.,Pause for a moment at the top, then slowly lower your heels back down to the starting position.,Repeat for the desired number of repetitions.,,,,,,,,,,,,,
waist,body weight,https://i.ibb.co/BNZbh5n/1.gif,1,3/4 sit-up,abs,hip flexors,lower back,,,Lie flat on your back with your knees bent and feet flat on the ground.,Place your hands behind your head with your elbows pointing outwards.,Engaging your abs, slowly lift your upper body off the ground, curling forward until your torso is at a 45-degree angle.,Pause for a moment at the top, then slowly lower your upper body back down to the starting position.,Repeat for the desired number of repetitions.,,,,,,,,,
waist,body weight,https://i.ibb.co/2yfk6Wm/2.gif,2,45° side bend,abs,obliques,,,,Stand with your feet shoulder-width apart and your arms extended straight down by your sides.,Keeping your back straight and your core engaged, slowly bend your torso to one side, lowering your hand towards your knee.,Pause for a moment at the bottom, then slowly return to the starting position.,Repeat on the other side.,Continue alternating sides for the desired number of repetitions.,,,,,,,,,
waist,body weight,https://i.ibb.co/KXtjfGT/3.gif,3,air bike,abs,hip flexors,,,,Lie flat on your back with your hands placed behind your head.,Lift your legs off the ground and bend your knees at a 90-degree angle.,Bring your right elbow towards your left knee while simultaneously straightening your right leg.,Return to the starting position and repeat the movement on the opposite side, bringing your left elbow towards your right knee while straightening your left leg.,Continue alternating sides in a pedaling motion for the desired number of repetitions.,,,,,,,,,,,
waist,body weight,https://i.ibb.co/8K77vgg/4.gif,2355,arm slingers hanging bent knee legs,abs,shoulders,back,,,Hang from a pull-up bar with your arms fully extended and your knees bent at a 90-degree angle.,Engage your core and lift your knees towards your chest, bringing them as close to your elbows as possible.,Slowly lower your legs back down to the starting position.,Repeat for the desired number of repetitions.,,,,,,,,,,,,
waist,body weight,https://i.ibb.co/wSpKRRj/5.gif,2333,arm slingers hanging straight legs,abs,shoulders,back,,,Hang from a pull-up bar with your arms fully extended and your legs straight down.,Engage your core and lift your legs up in front of you until they are parallel to the ground.,Hold for a moment at the top, then slowly lower your legs back down to the starting position.,Repeat for the desired number of repetitions.,,,,,,,,,,,,
waist,assisted,https://i.ibb.co/Yy7zDgd/6.gif,12,assisted lying leg raise with lateral throw down,abs,hip flexors,obliques,,,Lie flat on your back with your legs extended and your arms by your sides.,Place your hands under your glutes for support.,Engage your abs and lift your legs off the ground, keeping them straight.,While keeping your legs together, lower them to one side until they are a few inches above the ground.,Pause for a moment, then lift your legs back to the starting position.,Repeat the movement to the other side.,Continue alternating sides for the desired number of repetitions.,,,,,,,
waist,assisted,https://i.ibb.co/xqBqZ7X/7.gif,13,assisted lying leg raise with throw down,abs,hip flexors,quadriceps,,,Lie flat on your back with your legs extended and your arms by your sides.,Place your hands under your glutes for support.,Engage your core and lift your legs off the ground, keeping them straight.,Raise your legs until they are perpendicular to the ground.,Lower your legs back down to the starting position.,Simultaneously, throw your legs down towards the ground, keeping them straight.,Raise your legs back up to the starting position.,Repeat for the desired number of repetitions.,,,,,,
waist,medicine ball,https://i.ibb.co/TmKj8dV/8.gif,14,assisted motion russian twist,abs,obliques,lower back,,,Sit on the ground with your knees bent and feet flat on the floor.,Hold the medicine ball with both hands in front of your chest.,Lean back slightly, engaging your abs and keeping your back straight.,Slowly twist your torso to the right, bringing the medicine ball towards the right side of your body.,Pause for a moment, then twist your torso to the left, bringing the medicine ball towards the left side of your body.,Continue alternating sides for the desired number of repetitions.,,,,,,,
waist,body weight,https://i.ibb.co/CQp6DB7/9.gif,3204,arms overhead full sit-up (male),abs,hip flexors,lower back,,,Lie flat on your back with your knees bent and feet flat on the ground.,Extend your arms overhead, keeping them straight.,Engaging your abs, slowly lift your upper body off the ground, curling forward until your torso is upright.,Pause for a moment at the top, then slowly lower your upper body back down to the starting position.,Repeat for the desired number of repetitions.,,,,,,,,
waist,assisted,https://i.ibb.co/FY3NxJw/10.gif,1758,assisted sit-up,abs,hip flexors,,,,Sit on the edge of a bench or have someone hold your feet down.,Lie flat on your back with your knees bent and feet flat on the ground.,Place your hands behind your head with your elbows pointing outwards.,Engaging your abs, slowly lift your upper body off the ground, curling forward until your torso is at a 45-degree angle.,Pause for a moment at the top, then slowly lower your upper body back down to the starting position.,Repeat for the desired number of repetitions.,,,,,,,,
upper legs,barbell,https://i.ibb.co/D97g23r/1.gif,24,barbell bench front squat,quads,hamstrings,glutes,calves,,Start by standing with your feet shoulder-width apart and the barbell resting on your upper chest, just below your collarbone.,Hold the barbell with an overhand grip, keeping your elbows up and your upper arms parallel to the ground.,Lower your body down into a squat position by bending at the knees and hips, keeping your back straight and your chest up.,Pause for a moment at the bottom of the squat, then push through your heels to return to the starting position.,Repeat for the desired number of repetitions.,,,,,,,,
upper legs,assisted,https://i.ibb.co/kJqvT68/2.gif,1710,assisted lying gluteus and piriformis stretch,glutes,hamstrings,,,,Lie on your back with your legs extended.,Bend your right knee and place your right ankle on your left thigh, just above the knee.,Grasp your left thigh with both hands and gently pull it towards your chest.,Hold the stretch for 20-30 seconds.,Release the stretch and repeat on the other side.,,,,,,,,,,,
upper legs,body weight,https://i.ibb.co/bHs6Hph/3.gif,1512,all fours squad stretch,quads,hamstrings,glutes,,,Start on all fours with your hands directly under your shoulders and your knees directly under your hips.,Extend one leg straight back, keeping your knee bent and your foot flexed.,Slowly lower your hips towards the ground, feeling a stretch in your quads.,Hold this position for 20-30 seconds.,Switch legs and repeat the stretch on the other side.,,,,,,,,,,
upper legs,body weight,https://i.ibb.co/KN3RHzw/4.gif,3214,arms apart circular toe touch (male),glutes,hamstrings,quadriceps,calves,,Stand with your feet shoulder-width apart and arms extended to the sides.,Keeping your legs straight, bend forward at the waist and reach down towards your toes with your right hand.,As you reach down, simultaneously lift your left leg straight up behind you, maintaining balance.,Return to the starting position and repeat the movement with your left hand reaching towards your toes and your right leg lifting up behind you.,Continue alternating sides for the desired number of repetitions.,,,,,,,,,
upper legs,assisted,https://i.ibb.co/ZXvG9CX/5.gif,16,assisted prone hamstring,hamstrings,glutes,lower back,,,Lie face down on a mat or bench with your legs fully extended.,Have a partner or use a resistance band to secure your ankles.,Engage your hamstrings and lift your legs towards your glutes, keeping your knees straight.,Pause for a moment at the top, then slowly lower your legs back down to the starting position.,Repeat for the desired number of repetitions.,,,,,,,,,,
upper legs,assisted,https://i.ibb.co/6RjmQ5f/6.gif,1713,assisted prone lying quads stretch,quads,hamstrings,glutes,,,Lie face down on the ground with your legs extended.,Bend your left knee and reach back with your left hand to grab your left foot or ankle.,Gently pull your left foot towards your glutes, feeling a stretch in your left quad.,Hold the stretch for 20-30 seconds, then release.,Repeat with your right leg.,,,,,,,,,,
upper legs,body weight,https://i.ibb.co/jDdT4Tk/7.gif,1473,backward jump,quads,hamstrings,glutes,calves,,Stand with your feet shoulder-width apart.,Bend your knees slightly and jump backwards, pushing off with both feet.,Land softly on the balls of your feet, bending your knees to absorb the impact.,Repeat for the desired number of repetitions.,,,,,,,,,,,
upper legs,barbell,https://i.ibb.co/0K3RL8q/8.gif,26,barbell bench squat,quads,glutes,hamstrings,calves,,Set up a barbell on a squat rack at chest height.,Stand facing away from the rack, with your feet shoulder-width apart.,Bend your knees and lower your body down into a squat position, keeping your back straight and chest up.,Grasp the barbell with an overhand grip, slightly wider than shoulder-width apart.,Lift the barbell off the rack and step back, ensuring your feet are still shoulder-width apart.,Lower your body down into a squat, keeping your knees in line with your toes.,Pause for a moment at the bottom, then push through your heels to return to the starting position.,Repeat for the desired number of repetitions.,,,
upper legs,band,https://i.ibb.co/PQwXdQc/9.gif,980,band bent-over hip extension,glutes,hamstrings,lower back,,,Attach the band to a sturdy anchor point at ankle height.,Stand facing away from the anchor point with your feet shoulder-width apart.,Step back to create tension in the band, keeping your knees slightly bent.,Hinge at the hips and lean forward, maintaining a neutral spine.,Extend your right leg straight back, squeezing your glutes at the top.,Lower your right leg back down and repeat with the left leg.,Continue alternating legs for the desired number of repetitions.,,,,,,,
upper legs,assisted,https://i.ibb.co/cw3Y4gR/10.gif,1712,assisted side lying adductor stretch,adductors,hamstrings,glutes,,,Lie on your side with your legs straight and stacked on top of each other.,Bend your bottom leg slightly for stability.,Place your top foot on a stable surface, such as a bench or step.,Keeping your top leg straight, slowly lower it towards the ground, feeling a stretch in your inner thigh.,Hold the stretch for 20-30 seconds.,Return to the starting position and repeat on the other side.,,,,,,,,
upper legs,band,https://i.ibb.co/Ssw2jJv/11.gif,1408,band hip lift,glutes,hamstrings,quadriceps,,,Lie on your back with your knees bent and feet flat on the ground.,Place a resistance band just above your knees.,Engage your glutes and core muscles.,Press your heels into the ground and lift your hips off the floor, squeezing your glutes at the top.,Pause for a moment at the top, then slowly lower your hips back down to the starting position.,Repeat for the desired number of repetitions.,,,,,,,,,
upper legs,band,https://i.ibb.co/3NRGxRC/12.gif,984,band lying hip internal rotation,glutes,hamstrings,quadriceps,,,Lie on your back with your legs straight and a resistance band looped around your feet.,Bend your knees and bring them towards your chest, keeping your feet together.,Slowly rotate your knees outwards, away from each other, while keeping your feet together.,Pause for a moment at the end of the rotation, then slowly return to the starting position.,Repeat for the desired number of repetitions.,,,,,,,,
